{
  "schema_version": "1.0.0",
  "artifact": "diagram-manifest",
  "run_id": "RUN-20260601-163451",
  "generated_at": "2026-06-01T16:43:40+08:00",
  "producer": {
    "agent": "Render Validate Agent",
    "version": "1.0.0",
    "renderer": "fallback-png"
  },
  "inputs": [
    {
      "artifact": "diagram-specs",
      "path": "output/records/diagram-specs.json",
      "schema_version": "1.0.0"
    }
  ],
  "diagrams": [
    {
      "diagram_id": "DG001",
      "title": "系统总体架构图",
      "kind": "architecture",
      "mermaid_path": "output/records/diagrams/DG001.mmd",
      "image_path": "output/records/diagrams/DG001.png",
      "source_requirement_ids": [
        "T001",
        "Q001",
        "Q002",
        "Q003",
        "Q004",
        "Q005",
        "T002",
        "T003",
        "T004",
        "Q006",
        "T005"
      ],
      "description": "系统总体架构图，展示五层分层架构及核心模块，数据自下而上逐层流转。",
      "render_status": "fallback_rendered",
      "assembly_allowed": true,
      "image_check": {
        "exists": true,
        "width": 1600,
        "height": 1044,
        "file_size_bytes": 100857,
        "blank_risk": "low"
      },
      "errors": [
        {
          "message": "未找到 Mermaid CLI 渲染器，已生成降级 PNG。",
          "recoverable": true,
          "suggested_action": "安装 @mermaid-js/mermaid-cli 或通过 --renderer-command 指定渲染器以获得原生图。"
        }
      ],
      "review_notes": [
        "render_status=fallback_rendered：原生 Mermaid 渲染不可用或失败，已生成降级 PNG，需人工关注。"
      ]
    },
    {
      "diagram_id": "DG002",
      "title": "多源异构数据接入与解析流程图",
      "kind": "function_flow",
      "mermaid_path": "output/records/diagrams/DG002.mmd",
      "image_path": "output/records/diagrams/DG002.png",
      "source_requirement_ids": [
        "T001",
        "Q001"
      ],
      "description": "多源异构数据接入与解析流程图，从数据导入到元数据提取与标准化入库。",
      "render_status": "fallback_rendered",
      "assembly_allowed": true,
      "image_check": {
        "exists": true,
        "width": 1600,
        "height": 1220,
        "file_size_bytes": 78045,
        "blank_risk": "low"
      },
      "errors": [
        {
          "message": "未找到 Mermaid CLI 渲染器，已生成降级 PNG。",
          "recoverable": true,
          "suggested_action": "安装 @mermaid-js/mermaid-cli 或通过 --renderer-command 指定渲染器以获得原生图。"
        }
      ],
      "review_notes": [
        "render_status=fallback_rendered：原生 Mermaid 渲染不可用或失败，已生成降级 PNG，需人工关注。"
      ]
    },
    {
      "diagram_id": "DG003",
      "title": "输电资产台账与空间位置映射流程图",
      "kind": "function_flow",
      "mermaid_path": "output/records/diagrams/DG003.mmd",
      "image_path": "output/records/diagrams/DG003.png",
      "source_requirement_ids": [
        "Q002",
        "Q003"
      ],
      "description": "输电资产台账与空间位置映射流程图，利用GPS和位姿信息匹配杆塔并挂载至部件。",
      "render_status": "fallback_rendered",
      "assembly_allowed": true,
      "image_check": {
        "exists": true,
        "width": 1600,
        "height": 1220,
        "file_size_bytes": 85418,
        "blank_risk": "low"
      },
      "errors": [
        {
          "message": "未找到 Mermaid CLI 渲染器，已生成降级 PNG。",
          "recoverable": true,
          "suggested_action": "安装 @mermaid-js/mermaid-cli 或通过 --renderer-command 指定渲染器以获得原生图。"
        }
      ],
      "review_notes": [
        "render_status=fallback_rendered：原生 Mermaid 渲染不可用或失败，已生成降级 PNG，需人工关注。"
      ]
    },
    {
      "diagram_id": "DG004",
      "title": "人工智能视觉分析中台流程图",
      "kind": "function_flow",
      "mermaid_path": "output/records/diagrams/DG004.mmd",
      "image_path": "output/records/diagrams/DG004.png",
      "source_requirement_ids": [
        "Q004",
        "Q005",
        "T002"
      ],
      "description": "人工智能视觉分析中台流程图，包括可见光缺陷识别、红外热点分析及模型训练管理。",
      "render_status": "fallback_rendered",
      "assembly_allowed": true,
      "image_check": {
        "exists": true,
        "width": 1600,
        "height": 1396,
        "file_size_bytes": 75173,
        "blank_risk": "low"
      },
      "errors": [
        {
          "message": "未找到 Mermaid CLI 渲染器，已生成降级 PNG。",
          "recoverable": true,
          "suggested_action": "安装 @mermaid-js/mermaid-cli 或通过 --renderer-command 指定渲染器以获得原生图。"
        }
      ],
      "review_notes": [
        "render_status=fallback_rendered：原生 Mermaid 渲染不可用或失败，已生成降级 PNG，需人工关注。"
      ]
    },
    {
      "diagram_id": "DG005",
      "title": "三维点云数据处理与分析流程图",
      "kind": "function_flow",
      "mermaid_path": "output/records/diagrams/DG005.mmd",
      "image_path": "output/records/diagrams/DG005.png",
      "source_requirement_ids": [
        "T003",
        "T004"
      ],
      "description": "三维点云数据处理与分析流程图，从点云渲染到空间距离测算并标注危险点。",
      "render_status": "fallback_rendered",
      "assembly_allowed": true,
      "image_check": {
        "exists": true,
        "width": 1600,
        "height": 1396,
        "file_size_bytes": 83923,
        "blank_risk": "low"
      },
      "errors": [
        {
          "message": "未找到 Mermaid CLI 渲染器，已生成降级 PNG。",
          "recoverable": true,
          "suggested_action": "安装 @mermaid-js/mermaid-cli 或通过 --renderer-command 指定渲染器以获得原生图。"
        }
      ],
      "review_notes": [
        "render_status=fallback_rendered：原生 Mermaid 渲染不可用或失败，已生成降级 PNG，需人工关注。"
      ]
    },
    {
      "diagram_id": "DG006",
      "title": "缺陷管理与业务协同流程图",
      "kind": "function_flow",
      "mermaid_path": "output/records/diagrams/DG006.mmd",
      "image_path": "output/records/diagrams/DG006.png",
      "source_requirement_ids": [
        "Q006",
        "T005"
      ],
      "description": "缺陷管理与业务协同流程图，人机协同复核与工单流转闭环。",
      "render_status": "fallback_rendered",
      "assembly_allowed": true,
      "image_check": {
        "exists": true,
        "width": 1600,
        "height": 1396,
        "file_size_bytes": 80482,
        "blank_risk": "low"
      },
      "errors": [
        {
          "message": "未找到 Mermaid CLI 渲染器，已生成降级 PNG。",
          "recoverable": true,
          "suggested_action": "安装 @mermaid-js/mermaid-cli 或通过 --renderer-command 指定渲染器以获得原生图。"
        }
      ],
      "review_notes": [
        "render_status=fallback_rendered：原生 Mermaid 渲染不可用或失败，已生成降级 PNG，需人工关注。"
      ]
    }
  ],
  "render_summary": {
    "total": 6,
    "native_rendered": 0,
    "fallback_rendered": 6,
    "failed": 0,
    "blocked": 0
  }
}
