{
  "schema_version": "1.0.0",
  "artifact": "diagram-manifest",
  "run_id": "RUN-20260530-210000",
  "generated_at": "2026-05-30T21:00:00+08:00",
  "producer": {
    "agent": "Render Validate Agent",
    "version": "1.0.0",
    "renderer": "mermaid-cli"
  },
  "inputs": [
    {
      "artifact": "diagram-specs",
      "path": "output/records/diagram-specs.json",
      "schema_version": "1.0.0"
    }
  ],
  "diagrams": [
    {
      "diagram_id": "DG001",
      "title": "海图综合态势展示流程图",
      "kind": "function_flow",
      "mermaid_path": "output/records/DG001.mmd",
      "image_path": "output/records/DG001.png",
      "source_requirement_ids": ["T001"],
      "description": "展示海图数据读取、匹配和图层控制流程。",
      "render_status": "native_rendered",
      "assembly_allowed": true,
      "image_check": {
        "exists": true,
        "width": 1200,
        "height": 800,
        "file_size_bytes": 12000,
        "blank_risk": "low"
      },
      "errors": [],
      "review_notes": []
    }
  ],
  "render_summary": {
    "total": 1,
    "native_rendered": 1,
    "fallback_rendered": 0,
    "failed": 0,
    "blocked": 0
  }
}
